{
  "$schema": "https://json-schema.org/draft/2020-12/schema",
  "id": "contribution.proposed_solution",
  "version": "1.0.0",
  "x-version": "1.0.0",
  "pack": "base@1.0.0",
  "type": "object",
  "additionalProperties": false,
  "required": [
    "type",
    "target",
    "claim",
    "basis",
    "evidence_refs",
    "uncertainty",
    "assumptions",
    "mechanism",
    "responsible_role",
    "authority",
    "cost",
    "success_metric",
    "risks",
    "lawful_alternatives"
  ],
  "properties": {
    "type": {
      "const": "proposed_solution",
      "x-ui": {
        "widget": "hidden",
        "label_msg": "schema.contribution.common.type.label",
        "order": 1,
        "group": "claim"
      },
      "x-guidance": {
        "why": "Fixed by the form the person opened.",
        "good": "root_cause",
        "bad": "other"
      }
    },
    "target": {
      "type": "string",
      "pattern": "^[A-Za-z0-9][A-Za-z0-9_.:-]{0,63}$",
      "x-ui": {
        "widget": "ref",
        "label_msg": "schema.contribution.common.target.label",
        "help_msg": "schema.contribution.common.target.help",
        "order": 2,
        "group": "claim"
      },
      "x-guidance": {
        "why": "Says what this contribution answers: a problem, a task or another contribution.",
        "good": "prob-lights-0042",
        "bad": "the thing above"
      },
      "x-checks": {
        "dps": [
          "DP-CONTRIB-RELEVANCE"
        ]
      }
    },
    "claim": {
      "type": "string",
      "minLength": 20,
      "maxLength": 500,
      "x-ui": {
        "widget": "textarea",
        "label_msg": "schema.contribution.common.claim.label",
        "help_msg": "schema.contribution.common.claim.help",
        "order": 3,
        "group": "claim"
      },
      "x-guidance": {
        "why": "One clear statement the public can read, check and answer.",
        "good": "The lights on the north ring road have been out for several weeks.",
        "bad": "It is all broken.",
        "min_chars": 20,
        "max_chars": 500,
        "limits_key": "fields.contribution.proposed_solution.claim"
      },
      "x-checks": {
        "dps": [
          "DP-CONTRIB-RELEVANCE",
          "DP-PRIVACY",
          "DP-NAMING",
          "DP-TONE",
          "DP-CRISIS",
          "DP-ASSUMPTIONS",
          "DP-COMPLETENESS"
        ]
      }
    },
    "basis": {
      "enum": [
        "firsthand",
        "cited",
        "inferred"
      ],
      "x-ui": {
        "widget": "select",
        "label_msg": "schema.contribution.common.basis.label",
        "help_msg": "schema.contribution.common.basis.help",
        "order": 4,
        "group": "grounds"
      },
      "x-guidance": {
        "why": "Shows whether the claim was seen first hand, taken from a source or reasoned out.",
        "good": "firsthand",
        "bad": "sure"
      }
    },
    "evidence_refs": {
      "type": "array",
      "minItems": 0,
      "maxItems": 6,
      "items": {
        "type": "object",
        "additionalProperties": false,
        "required": [
          "url",
          "supports"
        ],
        "properties": {
          "url": {
            "type": "string",
            "minLength": 9,
            "maxLength": 300,
            "pattern": "^https?://\\S+$",
            "x-ui": {
              "widget": "url",
              "label_msg": "schema.contribution.common.evidence_refs.url.label",
              "help_msg": "schema.contribution.common.evidence_refs.url.help",
              "order": 1
            }
          },
          "supports": {
            "type": "string",
            "minLength": 10,
            "maxLength": 300,
            "x-ui": {
              "widget": "textarea",
              "label_msg": "schema.contribution.common.evidence_refs.supports.label",
              "help_msg": "schema.contribution.common.evidence_refs.supports.help",
              "order": 2
            }
          }
        }
      },
      "x-ui": {
        "widget": "list",
        "label_msg": "schema.contribution.common.evidence_refs.label",
        "help_msg": "schema.contribution.common.evidence_refs.help",
        "order": 5,
        "group": "grounds"
      },
      "x-guidance": {
        "why": "A link is not proof, so each one says what it supports.",
        "good": "Council repair log, supports the claim that the fault was reported.",
        "bad": "See link."
      },
      "x-checks": {
        "dps": [
          "DP-EVIDENCE-TIER",
          "DP-PRIVACY"
        ]
      }
    },
    "uncertainty": {
      "type": "string",
      "minLength": 5,
      "maxLength": 300,
      "x-ui": {
        "widget": "textarea",
        "label_msg": "schema.contribution.common.uncertainty.label",
        "help_msg": "schema.contribution.common.uncertainty.help",
        "order": 6,
        "group": "doubts"
      },
      "x-guidance": {
        "why": "Says what is not known so readers can weigh the claim.",
        "good": "I do not know how many lights are affected.",
        "bad": "None.",
        "min_chars": 5,
        "max_chars": 300
      },
      "x-checks": {
        "dps": [
          "DP-CONTRIB-RELEVANCE",
          "DP-PRIVACY",
          "DP-NAMING",
          "DP-TONE",
          "DP-CRISIS",
          "DP-ASSUMPTIONS",
          "DP-COMPLETENESS"
        ]
      }
    },
    "assumptions": {
      "type": "array",
      "minItems": 0,
      "maxItems": 8,
      "items": {
        "type": "string",
        "minLength": 10,
        "maxLength": 300
      },
      "x-ui": {
        "widget": "list",
        "label_msg": "schema.contribution.common.assumptions.label",
        "help_msg": "schema.contribution.common.assumptions.help",
        "order": 7,
        "group": "doubts"
      },
      "x-guidance": {
        "why": "Saying what you take for granted lets others check it.",
        "good": "I assume the lights share one power feed.",
        "bad": "No assumptions."
      },
      "x-checks": {
        "dps": [
          "DP-CONTRIB-RELEVANCE",
          "DP-PRIVACY",
          "DP-NAMING",
          "DP-TONE",
          "DP-CRISIS",
          "DP-ASSUMPTIONS",
          "DP-COMPLETENESS"
        ]
      }
    },
    "target_stage": {
      "type": "string",
      "pattern": "^[A-Za-z0-9][A-Za-z0-9_.:-]{0,63}$",
      "x-ui": {
        "widget": "ref",
        "label_msg": "schema.contribution.common.target_stage.label",
        "help_msg": "schema.contribution.common.target_stage.help",
        "order": 8,
        "group": "claim"
      },
      "x-guidance": {
        "why": "Says which stage of the plan this contribution is for. Leave it out to address the whole problem.",
        "good": "stage-lights-survey",
        "bad": "the next one"
      },
      "x-checks": {
        "dps": [
          "DP-CONTRIB-RELEVANCE"
        ]
      }
    },
    "for_later_stage": {
      "type": "boolean",
      "x-ui": {
        "widget": "hidden",
        "label_msg": "schema.contribution.common.for_later_stage.label",
        "help_msg": "schema.contribution.common.for_later_stage.help",
        "order": 9,
        "group": "claim"
      },
      "x-guidance": {
        "why": "Set by the server when the stage has not started. Not filled in by the person.",
        "good": "true",
        "bad": "yes"
      }
    },
    "mechanism": {
      "type": "string",
      "minLength": 20,
      "maxLength": 500,
      "x-ui": {
        "widget": "textarea",
        "label_msg": "schema.contribution.proposed_solution.mechanism.label",
        "help_msg": "schema.contribution.proposed_solution.mechanism.help",
        "order": 10,
        "group": "details"
      },
      "x-guidance": {
        "why": "The steps that turn the action into the result.",
        "good": "Fund a repair crew to fix the feed and add a second breaker.",
        "bad": "Just fix it.",
        "min_chars": 20,
        "max_chars": 500
      },
      "x-checks": {
        "dps": [
          "DP-CONTRIB-RELEVANCE",
          "DP-PRIVACY",
          "DP-NAMING",
          "DP-TONE",
          "DP-CRISIS",
          "DP-ASSUMPTIONS",
          "DP-COMPLETENESS",
          "DP-LEGALITY"
        ]
      }
    },
    "responsible_role": {
      "type": "string",
      "minLength": 5,
      "maxLength": 150,
      "x-ui": {
        "widget": "text",
        "label_msg": "schema.contribution.proposed_solution.responsible_role.label",
        "help_msg": "schema.contribution.proposed_solution.responsible_role.help",
        "order": 11,
        "group": "details"
      },
      "x-guidance": {
        "why": "A role, not a named person.",
        "good": "District lighting officer",
        "bad": "Someone",
        "min_chars": 5,
        "max_chars": 150
      },
      "x-checks": {
        "dps": [
          "DP-CONTRIB-RELEVANCE",
          "DP-PRIVACY",
          "DP-NAMING",
          "DP-TONE",
          "DP-CRISIS",
          "DP-ASSUMPTIONS",
          "DP-COMPLETENESS"
        ]
      }
    },
    "authority": {
      "type": "string",
      "minLength": 10,
      "maxLength": 300,
      "x-ui": {
        "widget": "textarea",
        "label_msg": "schema.contribution.proposed_solution.authority.label",
        "help_msg": "schema.contribution.proposed_solution.authority.help",
        "order": 12,
        "group": "details"
      },
      "x-guidance": {
        "why": "The rule, budget line or mandate that allows it.",
        "good": "The district maintenance budget covers street lighting repairs.",
        "bad": "They can.",
        "min_chars": 10,
        "max_chars": 300
      },
      "x-checks": {
        "dps": [
          "DP-CONTRIB-RELEVANCE",
          "DP-PRIVACY",
          "DP-NAMING",
          "DP-TONE",
          "DP-CRISIS",
          "DP-ASSUMPTIONS",
          "DP-COMPLETENESS",
          "DP-LEGALITY"
        ]
      }
    },
    "cost": {
      "type": "string",
      "minLength": 10,
      "maxLength": 300,
      "x-ui": {
        "widget": "textarea",
        "label_msg": "schema.contribution.proposed_solution.cost.label",
        "help_msg": "schema.contribution.proposed_solution.cost.help",
        "order": 13,
        "group": "details"
      },
      "x-guidance": {
        "why": "A rough range and who pays. Say if you do not know.",
        "good": "Roughly 2,000 to 4,000 in parts and labour from the repair budget.",
        "bad": "Cheap.",
        "min_chars": 10,
        "max_chars": 300
      },
      "x-checks": {
        "dps": [
          "DP-CONTRIB-RELEVANCE",
          "DP-PRIVACY",
          "DP-NAMING",
          "DP-TONE",
          "DP-CRISIS",
          "DP-ASSUMPTIONS",
          "DP-COMPLETENESS"
        ]
      }
    },
    "success_metric": {
      "type": "string",
      "minLength": 10,
      "maxLength": 300,
      "x-ui": {
        "widget": "textarea",
        "label_msg": "schema.contribution.proposed_solution.success_metric.label",
        "help_msg": "schema.contribution.proposed_solution.success_metric.help",
        "order": 14,
        "group": "details"
      },
      "x-guidance": {
        "why": "Something that can be observed.",
        "good": "All lights on the ring road work for 30 nights in a row.",
        "bad": "It feels better.",
        "min_chars": 10,
        "max_chars": 300
      },
      "x-checks": {
        "dps": [
          "DP-CONTRIB-RELEVANCE",
          "DP-PRIVACY",
          "DP-NAMING",
          "DP-TONE",
          "DP-CRISIS",
          "DP-ASSUMPTIONS",
          "DP-COMPLETENESS"
        ]
      }
    },
    "risks": {
      "type": "array",
      "minItems": 1,
      "maxItems": 6,
      "items": {
        "type": "string",
        "minLength": 10,
        "maxLength": 300
      },
      "x-ui": {
        "widget": "list",
        "label_msg": "schema.contribution.proposed_solution.risks.label",
        "help_msg": "schema.contribution.proposed_solution.risks.help",
        "order": 15,
        "group": "details"
      },
      "x-guidance": {
        "why": "One risk per entry, at least one.",
        "good": "The repair may take the road dark for one night.",
        "bad": "None."
      },
      "x-checks": {
        "dps": [
          "DP-CONTRIB-RELEVANCE",
          "DP-PRIVACY",
          "DP-NAMING",
          "DP-TONE",
          "DP-CRISIS",
          "DP-ASSUMPTIONS",
          "DP-COMPLETENESS"
        ]
      }
    },
    "lawful_alternatives": {
      "type": "array",
      "minItems": 1,
      "maxItems": 6,
      "items": {
        "type": "string",
        "minLength": 10,
        "maxLength": 300
      },
      "x-ui": {
        "widget": "list",
        "label_msg": "schema.contribution.proposed_solution.lawful_alternatives.label",
        "help_msg": "schema.contribution.proposed_solution.lawful_alternatives.help",
        "order": 16,
        "group": "details"
      },
      "x-guidance": {
        "why": "Other lawful ways to reach the same goal, at least one.",
        "good": "Temporary solar lamps at the worst junctions.",
        "bad": "Do something else."
      },
      "x-checks": {
        "dps": [
          "DP-CONTRIB-RELEVANCE",
          "DP-PRIVACY",
          "DP-NAMING",
          "DP-TONE",
          "DP-CRISIS",
          "DP-ASSUMPTIONS",
          "DP-COMPLETENESS",
          "DP-LEGALITY"
        ]
      }
    }
  },
  "x-checks": {
    "dps": [
      "DP-CONTRIB-RELEVANCE",
      "DP-PRIVACY",
      "DP-NAMING",
      "DP-TONE",
      "DP-CRISIS",
      "DP-ASSUMPTIONS",
      "DP-COMPLETENESS",
      "DP-LEGALITY"
    ]
  }
}
